{
  "additional_claims": [],
  "answer_mode": "answer",
  "answerability_satisfied": true,
  "assessment_complete": true,
  "citation_links": [
    {
      "citation_id": "s1",
      "claim_id": "c1",
      "reason": "The citation directly supports the claim about the deploy command passing an export_fn lambda.",
      "supported": true
    },
    {
      "citation_id": "s2",
      "claim_id": "c2",
      "reason": "The citation directly supports the claim about the export utility's behavior.",
      "supported": true
    }
  ],
  "critical_error": true,
  "diagram": {
    "assessed": false,
    "complete": false,
    "consistent": false,
    "findings": [],
    "material_error": false,
    "readable": false,
    "supported": false
  },
  "disagreements": [],
  "false_execution_claim": false,
  "needs_review": false,
  "required_claims": [
    {
      "coverage": "complete",
      "evidence_keys": [
        "d04a38f76681ded3259c757ccc6b5d0104ca68b3f53be4b0dc84b488bbbbedf0"
      ],
      "id": "c1",
      "material_error": false,
      "reason": "The evidence from reflex/reflex.py confirms that the deploy command passes an export_fn lambda to hosting_cli.deploy, which invokes export_utils.export with the specified parameters.",
      "verdict": "supported"
    },
    {
      "coverage": "complete",
      "evidence_keys": [
        "d63315bed3ad0c92879c11ddb6170be9ac6150976272f73a2cc169324fb6c265"
      ],
      "id": "c2",
      "material_error": false,
      "reason": "The evidence from reflex/utils/export.py confirms that the export utility compiles and sets up the frontend when enabled and invokes build.zip_app when zipping is enabled.",
      "verdict": "supported"
    }
  ],
  "uncited_claim_ids": []
}
